Text,Intent
اسم هنرمند سازنده این آهنگ چیست,music_query
متن این آهنگ چیست,music_query
میتونی اطلاعات خواننده این آهنگ را بگی,music_query
آهنگ در حال پخش رو شناسایی کن,music_query
اسم اهنگ در حال پخش را به من نشان بده,music_query
چند تا ابی برام پخش کن,music_query
چه کسی می‌خواند,music_query
کدام خواننده این اهنگ را خوانده,music_query
الان چه کسی می‌خواند,music_query
ایا این اهنگ جزو بیست اهنگ برتر بود,music_query
قطعه ی اهنگ,music_query
خواننده کیست,music_query
موسیقی این هنرمند رو نشان بده,music_query
در مورد آهنگی که اغلب گوش میدم میتونی اطلاعات بیشتری بدی,music_query
من معمولا به چه موزیکی گوش میدم,music_query
چه اهنگی را من ترجیح میدهم,music_query
خواننده این اهنگ کیه,music_query
این آهنگ که در حال پخش هست از کدام ژانر هست,music_query
خواننده ی این آهنگ کیست,music_query
گوگل من به کدوم آهنگ ها حداقل ده بار گوش دادم,music_query
چه زمانی اولین بار این آهنگ ضبط شد,music_query
اسم این آهنگ چیه و چه کسی آن را میخواند,music_query
اوولی الان این اهنگی که داره پخش میشه چیه,music_query
به من بگو چه آهنگی در حال پخش است,music_query
من از چه نوع اهنگی لذت میبرم,music_query
انواع موزیک مورد علاقه من چیست,music_query
این اهنگ از چه کسی هست,music_query
این چیست که ما داریم گوش می دهیم,music_query
چه کسی پیانو این قطعه را مینوازد,music_query
این آهنگی که داره از گوشیم پخش می شه رو می شناسی,music_query
اسم آهنگ فعلی چیست,music_query
چه اهنگی در حال پخش است,music_query
من دارم به چه اهنگی گوش میدم,music_query
اطلاعات قطعه ای که در حال پخش هست چیست,music_query
این آهنگ تو کدوم آلبومه,music_query
اهنگ ترس,music_query
ساندکلاد,music_query
اسم خواننده این آهنگ را برای من پیدا کن,music_query
لطفا اسم این گروه موسیقی را به من بگو,music_query
اهنگی که من اغلب گوش میدهم چیست,music_query
این اهنگ چطور است,music_query
در چه سالی این آهنگ ضبط شده,music_query
اسم اهنگ در حال پخش را بگو,music_query
کدام فهرست آهنگ روی حالت پخش ترکیبی هست,music_query
این اهنگ چقدر طول میکشد,music_query
آهنگ فیلم سلطان قلب ها,music_query
خواننده هایی شبیه ابی پیشنهاد بده,music_query
چه آهنگی را من اغلب گوش میدهم,music_query
کدام ژانر موسیقی را من بیشتر پخش می کنم,music_query
چه کسی این راه خوانده است,music_query
اسم گروه موسیقی,music_query
این کیست,music_query
اسم آهنگی که داره پخش میشه چیه,music_query
اهنگ در حال پخش از کیست,music_query
لطفا جزئیات اهنگ قبلی را به من نشان بده,music_query
مرتب,music_query
اولین عبارت این اهنگ را به من بگو,music_query
اسم و سبک این آهنگ را به من بده,music_query
این اهنگ برای کدام فیلم است,music_query
لیست پخش را نشان بده,music_query
اسم آهنگ ساز را به من بگو,music_query
عکس خواننده را به من نشان بده,music_query
تاریخ انتشار این آهنگ را به من بگو,music_query
در این لحظه موزیک مورد علاقه من چیست,music_query
کدام آهنگ را بیشتر از همه پخش کردم,music_query
من به چه سبک موسیقی علاقه دارم,music_query
آن آهنگ که در پس‌زمینه پخش می‌شود چیست,music_query
آلبوم های خوب رپ امسال,music_query
اولی یک آلبوم رپ خوب که امسال درآمده چیست,music_query
موضوعات موسیقی,music_query
جزئیات کار و زندگی داریوش اقبالی,music_query
موزیک مورد علاقه من از سیاوش قمیشی رو پخش کن,music_query
همه اهنگ ها را لیست کن,music_query
شماره آهنگ را به من بگو,music_query
آلبوم جدید تتلو چه احساسی بهت داد,music_query
خواننده ی این اهنگ کیه,music_query
من می خواهم درباره این آهنگ بدانم,music_query
چه کسی اهنگی را که در مورد عشق است خوانده,music_query
درباره ی این آهنگ توضیح بده,music_query
چه موزیکی در حال پخش است,music_query
سلام اوولی لطفا اسم این آهنگی که در حال پخش هست را به من بگو,music_query
اسم این آهنگ چیه,music_query
اسم,music_query
آن اهنگ در حال پخش چیست,music_query
عنوان موزیک فعلی را برای من بیاور,music_query
چه اهنگی در حال پخش هست الان,music_query
خواننده ی ترس کیست,music_query
آن اهنگ از چه نوع موزیکی هست,music_query
این آهنگ کدوم فیلمه و اسمش چیه,music_query
چه آهنگی در رادیو پخش می‌شود,music_query
اطلاعات آهنگ,music_query
چه کسی این ترانه را نوشته است,music_query
این اهنگ در چه سالی بیرون امده,music_query
فکر میکنی چه نوع موزیکی دوست دارم,music_query
چه اهنگی الان در حال پخش هست,music_query
میدونی اسم اهنگ در حال پخش چیست,music_query
چه کسی اهنگی که الان دارم گوش میدم را خوانده است,music_query
سبک این موسیقی چیه,music_query
اهنگ را شناسایی کن,music_query
این اهنگ کدام است,music_query
اسم آهنگ,music_query
ایا این اهنگ از ابی هست,music_query
تولید کننده ی این آهنگ کیه,music_query
ایا این اهنگ از ابی هست,music_query
الان در رادیو چه اهنگی در حال پخش هست,music_query
اسم این قطعه ای که پخش می کنی چیست,music_query
این چه کسی است در رادیو صحبت می‌کند,music_query
این خواننده کیست,music_query
پیدا کن که این اهنگ کدام است و اسمش را به من بگو,music_query
دوست داشتنی ترین آهنگ‌های گوگوش کدامند,music_query
گروه در حال پخش چیست,music_query
این کدوم آهنگه,music_query
متن این آهنگ را برای من ایمیل کن,music_query
متن اهنگ ترس از شادمهر چیست,music_query
شماره نه اهنگ راک در حال پخش شدن میباشد,music_query
خواننده ی آهنگی که الان داره پخش میشه چه کسی هست,music_query
آیا امکانش هست که مشابه موسیقی من را تهیه کنی,music_query
چه اهنگی در حال پخش است,music_query
اسم اهنگ در حال پخش را چک کن,music_query
اسم آن آهنگ در حال پخش چیست,music_query
اسم آهنگی که داره پخش میشه چیه,music_query
این اهنگ چیست,music_query
اسم هنرمند را به من بگو,music_query
نام آهنگ چیست,music_query
به این آهنگ گوش کن,music_query
این اهنگ در چه سالی ساخته شده,music_query
اسم خواننده اصلی در این گروه چیست,music_query
چطور ان اهنگ را تکرار کنیم,music_query
ان اهنگ چیست,music_query
این آهنگی که داره پخش می شه مال کیه,music_query
این ملودی رو قبلا شنیدم کی از روی این کپی کرده,music_query
اسم این گروه موسیقی چیست,music_query
درباره ی این ترانه چی می دونی,music_query
چه کسی این را خوانده,music_query
تو itunes چی جدیده,music_query
اهنگ در حال پخش چیست,music_query
لطفا جزییاتی از آهنگ‌های اشکان فدایی بهم بده,music_query
در مورد اهنگ در حال پخش به من اطلاعات بده,music_query
یک پلی لیست به من بگو,music_query
آیا آهنگ ابی را می‌شنوی,music_query
الی ساکت شو,audio_volume_mute
توقف,audio_volume_mute
برای ده ثانیه متوقف کن,audio_volume_mute
برای ده ثانیه مکث کن,audio_volume_mute
بیصدا,audio_volume_mute
ساکت,audio_volume_mute
سکوت لطفا,audio_volume_mute
بلندگوها خاموش,audio_volume_mute
ساکت لطفا,audio_volume_mute
آیا میتوانی بیصدا کنی وقتی من خانه نیستم,audio_volume_mute
بی صدا کن برای بیست دقیقه,audio_volume_mute
خودت را بیصدا کن تا زمانی که من غیر از این بگویم,audio_volume_mute
برای مدتی صحبت نکن,audio_volume_mute
لطفا صدای بلندگوها رو قطع کن.,audio_volume_mute
گوگل لطفا صدای بلندگوها رو کم کن.,audio_volume_mute
آیا لطفا بلندگوهای من را بیصدا میکنی,audio_volume_mute
صدا خاموش,audio_volume_mute
لطفا برای یک لحظه قطع کن,audio_volume_mute
لطفا خودت را متوقف کن,audio_volume_mute
خودت را بیصدا کن,audio_volume_mute
خفه شو,audio_volume_mute
سکوت,audio_volume_mute
ساکت باش,audio_volume_mute
بلندگوها را بی صدا کن,audio_volume_mute
حالت بیصدا را تنظیم کن برای یک ساعت,audio_volume_mute
لطفا صدا را به حالت بیصدا تغییر بده,audio_volume_mute
شب بخیر,audio_volume_mute
من صدا نمیخواهم,audio_volume_mute
بلندگوها را خاموش کن,audio_volume_mute
بلندگو را خاموش کن,audio_volume_mute
صدا را به صفر برسان,audio_volume_mute
صدای بلندگو رو تا آخرین درجه زیاد کن.,audio_volume_mute
لطفا ساکت باش برای دو ساعت آینده,audio_volume_mute
خودت را تا پنج بعدازظهر بیصدا کن,audio_volume_mute
تا فردا ساکت باش لطفا.,audio_volume_mute
چهار ساعت حالت سکوت,audio_volume_mute
لطفا ساکت باش تا زمانی که من بگویم,audio_volume_mute
حالت سکوت,audio_volume_mute
من هفت بعدازظهر امشب جلسه ای دارم لطفا موسیقی را برای یک ساعت بیصدا کن,audio_volume_mute
الان صدا را بی صدا کن,audio_volume_mute
بلندگوهای اتاق نشیمن را بیصدا کن,audio_volume_mute
موسیقی را مکث کن,audio_volume_mute
موسیقی رو قطع کن.,audio_volume_mute
بی صدا برای دو ساعت,audio_volume_mute
برای یک روز ساکت باش,audio_volume_mute
برای چهل دقیقه صدایی تولید نکن,audio_volume_mute
لطفا صدا را بیصدا کن,audio_volume_mute
لطفا صدا رو قطع کن.,audio_volume_mute
من میخواهم بلندگوها را بیصدا کنم لطفا,audio_volume_mute
صدا را خاموش کن,audio_volume_mute
صدا رو قطع کن.,audio_volume_mute
صدا را بی صدا کن,audio_volume_mute
لطفا نگه دار برای ساعت بعد,audio_volume_mute
من در جلسه هستم لطفا صحبت نکن,audio_volume_mute
صدا رو قطع کن.,audio_volume_mute
لطفا بلندگوها را بی صدا کن,audio_volume_mute
لطفا ساکت باش,audio_volume_mute
صدا را خاموش کن,audio_volume_mute
بلندگو را بیصدا کن,audio_volume_mute
لطفا بلندگو را ساکت کن,audio_volume_mute
زمان سکوت است,audio_volume_mute
برای بیست دقیقه بی صدا کن,audio_volume_mute
ساکت باش تا سه بعدازظهر,audio_volume_mute
گوشی رو به حالت بی صدا تغییر بده تا زمانی که هشدار م خاموش بشه,audio_volume_mute
صدا رو بذار روی صفر,audio_volume_mute
گوگل لطفا سکوت رو رعایت کن بچه خوابه,audio_volume_mute
برای سی دقیقه ساکت باش,audio_volume_mute
من نیاز دارم بلندگو را بی صدا کنم,audio_volume_mute
من میخواهم بلندگو بیصدا شود,audio_volume_mute
بیصدا فعال شد تا زمانی که من بگویم,audio_volume_mute
صدا را بیصدا کن,audio_volume_mute
صدا خاموش لطفا,audio_volume_mute
لطفا بلندگوها را بی صدا کن,audio_volume_mute
همین الان صدا رو قطع کن.,audio_volume_mute
لطفا صدا رو قطع کن.,audio_volume_mute
آن را متوقف کن,audio_volume_mute
لطفا ساکت باش,audio_volume_mute
بلندگوی من را بی صدا کن اینجا من نیاز دارم تماس تلفنی بگیرم,audio_volume_mute
لطفا صحبت نکن,audio_volume_mute
صدا را خاموش کن,audio_volume_mute
صدا را بیصدا کن,audio_volume_mute
تنظیمات را بر روی حالت بیصدا تنظیم کن,audio_volume_mute
بلندگوها را بی صدا کن,audio_volume_mute
بر روی حالت بی صدا تنظیم کن,audio_volume_mute
بیصدا باش,audio_volume_mute
پنهانش کن,audio_volume_mute
استفاده نکن,audio_volume_mute
نویز را قطع کن,audio_volume_mute
صدا را بی صدا کن,audio_volume_mute
صدای پخش رو کم کن.,audio_volume_mute
آیا می توانی بلندگوی من را بیصدا کنی,audio_volume_mute
بلندگو ی من رو خاموش کن,audio_volume_mute
طی سه ساعت آینده روی حالت بی صدا باش,audio_volume_mute
لطفا خودت را بیصدا کن,audio_volume_mute
لطفا خودت را از حالت بیصدا خارج کن,audio_volume_mute
ساکت بمان,audio_volume_mute
ورود به حالت سکوت,audio_volume_mute
لطفا تلویزیون را برای یک ساعت بی صدا کن,audio_volume_mute
دستگاه موسیقی رو ساکت کن,audio_volume_mute
آیا می توانی رادیو را بر روی حالت بی صدا تنظیم کنی,audio_volume_mute
صدا را قطع کن,audio_volume_mute
ساکت,audio_volume_mute
حالت سکوت را فعال کن,audio_volume_mute
من می خواهم بی صدا باشی,audio_volume_mute
نویز را کم کن,audio_volume_mute
کنترل صدا,audio_volume_mute
برای پنجاه ثانیه جواب نده,audio_volume_mute
صحبت نکن,audio_volume_mute
پنج دقیقه هیچ اعلانی نشون نده,audio_volume_mute
هیچ اعلامی برای پنج دقیقه,audio_volume_mute
ساکت,audio_volume_mute
صدا را بی صدا کن,audio_volume_mute
لطفا برای یک ساعت دیگر بی صدا باش,audio_volume_mute
امروز صحبت نکن,audio_volume_mute
صحبت نکن تا زمانی که من از شما بخواهم,audio_volume_mute
سیری صدای بلندگوها رو قطع کن.,audio_volume_mute
هیچ نویزی ایجاد نکن تا زمان زنگ هشدار صبح,audio_volume_mute
حالت سکوت فعال تا زمانی که من از کار به خانه برگردم,audio_volume_mute
سکوت برای دو ساعت,audio_volume_mute
از حالا به بعد بی صدا باش,audio_volume_mute
حالت سکوت,audio_volume_mute
بلندگوها را بی صدا کن,audio_volume_mute
صدا بلندگوها را کم کن,audio_volume_mute
بلندگوها را خاموش کن,audio_volume_mute
زمان سکوت,audio_volume_mute
صدا را قطع کن,audio_volume_mute
لطفا بی صدا,audio_volume_mute
بیصدا برای پانزده دقیقه,audio_volume_mute
موسیقی را بی صدا کن,audio_volume_mute
صداها را خاموش کن,audio_volume_mute
لطفا صحبت کردن را متوقف کن,audio_volume_mute
بلندگوها را بر روی حالت بی صدا تنظیم کن,audio_volume_mute
صحبت نکن,audio_volume_mute
اطلاعات را پاک کن,audio_volume_mute
صدا را قطع کن,audio_volume_mute
لطفا صدای بلندگو رو قطع کن,audio_volume_mute
لرزش بلندگو را خاموش کن,audio_volume_mute
بیصدا برای یک ساعت,audio_volume_mute
هیچ صدایی تولید نکن,audio_volume_mute
آیا می توانی صحبت کردن را متوقف کنی,audio_volume_mute
برای یک ساعت صحبت نکن,audio_volume_mute
لطفا برای پنج دقیقه بی صدا کن,audio_volume_mute
برای یک ساعت بعد بیصدا باش,audio_volume_mute
بلندگوها را بیصدا کن,audio_volume_mute
لطفا خاموش شو,audio_volume_mute
دکمه بیصدا را لمس کن,audio_volume_mute
لطفا بلندگو را بیصدا کن,audio_volume_mute
الان صدای همه‌ی جواب‌ها رو ببند,audio_volume_mute
صحبت نکن لطفا,audio_volume_mute
صدای بلندگوها رو قطع کن.,audio_volume_mute
برو به خواب,audio_volume_mute
لطفا پاسخ نده,audio_volume_mute
صدا را بی صدا کن,audio_volume_mute
صدا را متوقف کن,audio_volume_mute
تنظیمات را بیصدا کن,audio_volume_mute
بی صدا تنظیم کن تا زمانی که غیر این گفته شود,audio_volume_mute
آیا میتوانی برای یک مدتی بی صدا باشی,audio_volume_mute
چه مدت باید تخم‌مرغ‌ها را بجوشانم,cooking_recipe
چه ترکیباتی برای سوپ جو نیاز دارم,cooking_recipe
طرز تهیه کیک پنیری چیست,cooking_recipe
به من بگو چگونه استیک بپزم,cooking_recipe
چه چیزهایی برای تهیه پیتزا لازم است,cooking_recipe
چه موادی برای تهیه پیتزا لازم است,cooking_recipe
دستور پخت سس پاستا چیه,cooking_recipe
دستور تهیه سس پاستا چیست,cooking_recipe
دلمه ی مو رو چطور بپیچم,cooking_recipe
تخم مرغ آب پز چند دقیقه باید بجوشه,cooking_recipe
علی چه مقدار زمان برا ی پختن ماکارونی لازم است,cooking_recipe
به من بگو چطور پاستا بپزم,cooking_recipe
اولی چطوری پاستا بپزم,cooking_recipe
olly چه موادی برای پودینگ مورد نیاز است,cooking_recipe
دستور پخت یک شام عاشقانه دو نفره را پیدا کن,cooking_recipe
من مقداری سالمون دارم چطور می توانم این را آماده کنم,cooking_recipe
چه مدت باید از هر طرف یک همبرگر را بپزم,cooking_recipe
روغن برای سرخ کردن سیب زمینی سرخ کرده چه دمایی باید داشته باشد,cooking_recipe
دستور پخت دیزی چیه,cooking_recipe
محبوبترین دستور پخت قورمه سبزی را پیدا کن,cooking_recipe
بهترین دستور پخت قورمه سبزی چیست,cooking_recipe
چه مدت آن را می‌پزی,cooking_recipe
برای من یک دستور پخت بگیر,cooking_recipe
مرغ پخته شده باید چه دمایی باشد,cooking_recipe
چه مدت باید یک مرغ کامل را در فر سیصد و هفتاد و پنج درجه پخت,cooking_recipe
چگونه برنج را بخارپز کنم,cooking_recipe
چیزهای عجیبی که مردم دوست دارند بدانند,cooking_recipe
بهترین روش پخت ماکارونی چیست,cooking_recipe
غذایی هست که با کینوا درست بشه و بدمزه نباشه,cooking_recipe
چاقوی گوشت خورد کن رو چطوری تیز کنم,cooking_recipe
یک جایگزین گیاهی خوب برای تخم مرغ چیست,cooking_recipe
اوولی یک جایگزین تخم مرغ گیاهی خوب چیست,cooking_recipe
برام مقداری ماکارونی بپز که توش پنیر و عسل داشته باشه,cooking_recipe
اوولی چگونه شروع به تهیه دیزی کنم,cooking_recipe
دستور پخت استیک را بهم بده,cooking_recipe
می‌شود با مرغ استیک درست کنیم,cooking_recipe
یخ زده,cooking_recipe
تبخیر شد,cooking_recipe
چگونه می‌توانم آشپزی یاد بگیرم,cooking_recipe
چطوری آشپزی یاد بگیرم,cooking_recipe
برنامه دارچین رو نشان بده,cooking_recipe
دستور پخت قورمه سبزی را به من بگو,cooking_recipe
چقدر طول می کشد تا آب بجوشد,cooking_recipe
یک نفر به چه چیزی در کرم صدمه می زند تا کره درست کند,cooking_recipe
چگونه یک تخم مرغ را آب پز کنم,cooking_recipe
چطور از شیر اب دوغ درست کردن,cooking_recipe
دستور تهیه ی یک صبحانه ی کم کالری,cooking_recipe
من می‌خواهم پاستا را به روش آمریکایی بپزم به من نشان بده چگونه,cooking_recipe
اولی چطور برنج درست کنم,cooking_recipe
چطور برنج درست کردن,cooking_recipe
اوولی روش تهیه بستنی را به نشان بده,cooking_recipe
دستور پخت سبزیجات,cooking_recipe
دستور پخت برای وعده غذایی,cooking_recipe
چطور می توانم یک غذا درست کنم,cooking_recipe
یک وعده غذایی صبحانه ناهار شام انتخاب کن,cooking_recipe
غذای مورد علاقه خود را جستجو کن,cooking_recipe
انتخاب دستور پخت,cooking_recipe
می‌خواهم طرز تهیه قورمه سبزی را در پنج جمله بدانم,cooking_recipe
در پنج جمله طرز تهیه فسنجون رو به من اطلاع بده,cooking_recipe
گوشت بره را چطوری کباب می‌کنی,cooking_recipe
به من نشان بده که مواد تشکیل دهنده چیستند,cooking_recipe
برای من دستور پخت بیف استراگانوف را پیدا کن,cooking_recipe
به من بگو چطوری زرشک پلو با مرغ بخرم,cooking_recipe
مراحل تهیه غذا را در google جستجو کن,cooking_recipe
دستور پختی پیدا کن که از گوشت چرخ کرده و کدو سبز استفاده می‌کند,cooking_recipe
در چه دمایی سیب‌زمینی را می پزی,cooking_recipe
من به یک دستور پخت قورمه سبزی نیاز دارم که قدمت آن به قبل از سال هزار و نهصد و هفتاد برسد,cooking_recipe
طرز پخت پیتزا چیست,cooking_recipe
در مورد ماهی سرخ شده به طور مختصر توضیح بده,cooking_recipe
طرز تهیه برگر چیست,cooking_recipe
دستور پخت برنج طارم را به من بگو,cooking_recipe
طرز پخت برنج زرد چیست,cooking_recipe
دستور پخت کلوچه چگونه است,cooking_recipe
کجا می‌توانم آن دستور‌العمل کلوچه گردویی را پیدا کنم,cooking_recipe
فسنجون چند قاشق شکر نیاز داره,cooking_recipe
زرشک پلو چطور درست می شه,cooking_recipe
چگونه می توانم یک استیک گوشت را بپزم,cooking_recipe
چگونه آن غذا را بپزم,cooking_recipe
برای من دستور پخت اسپاگتی را پیدا کن,cooking_recipe
دستور پخت سوپ جو را برای من پیدا کن,cooking_recipe
بهترین دستور پخت برای سس پستو چیست,cooking_recipe
چطوری پاستا درست می‌کنی,cooking_recipe
برای درست کردن کباب کوبیده به چی نیاز دارم,cooking_recipe
مارگارین با چی جایگزین میشه,cooking_recipe
گوشت راسته ی گوسفند به چند ساعت پخت نیاز داره,cooking_recipe
چه غذایی خوب است,cooking_recipe
محتویات ادویه کاری چیست,cooking_recipe
روزانه چقدر باید سبزیجات بخورم,cooking_recipe
چه ادویه‌هایی در غذای هندی وجود دارد,cooking_recipe
دستور پخت پوره سیب زمینی را به من بگو,cooking_recipe
چطور پوره‌ی سیب زمینی درست کنم,cooking_recipe
زمان پخت پوره سیب زمینی چقدر است,cooking_recipe
در یک فنجان چند قاشق چای خوری جای می گیرد,cooking_recipe
چه مدت یک مرغ کامل را در سیصد و پنجاه درجه می‌پزید,cooking_recipe
ترکیبات جوجه بریان را پیدا کن,cooking_recipe
چقدر طول می کشد که یک تخم مرغ را به راحتی بپزید,cooking_recipe
چه زمانی فصل مارچوبه است,cooking_recipe
دستور پخت آسان برای غذا چیست,cooking_recipe
چطوری لازانیای گیاهی درست می کنی,cooking_recipe
یک دستور پخت برای کیک یزدی پیدا کن,cooking_recipe
جایگزین آرد چیست,cooking_recipe
دنبال دستور پخت های متفاوت میگردم,cooking_recipe
من چطور می توانم دیزی بپزم,cooking_recipe
دستور پخت کوفته تبریزی,cooking_recipe
