Text,Intent
همه ی رویدادها و کارها ی امروز رو از تقویم پاک کن.,calendar_remove
تمام تقویم من را برای امروز حذف کن,calendar_remove
این رویداد را در سیزدهم اسفند حذف کن,calendar_remove
می‌توانی این رویداد مهمانی شام را حذف کنی,calendar_remove
این رویداد از تقویم من حذف کن,calendar_remove
تقویم من را از همه رویدادها پاک کن,calendar_remove
رویدادهای فعلی من را از تقویم پاک کن,calendar_remove
رویداد تقویم آینده من را حذف کن,calendar_remove
رویداد بعدی رو از تقویم من پاک کن.,calendar_remove
لطفا قرار ناهار من را از برنامه سوم فروردین حذف کن,calendar_remove
قرار فردای من را حذف کن,calendar_remove
جلسه من برای جمعه را لغو کن,calendar_remove
برنامه من را تغییر بده رویداد بعدی من را پاک کن,calendar_remove
تقویم من را به روز کن و رویداد بعدی را حذف کن,calendar_remove
همه رویدادها را از هفتم فروردین پاک کن,calendar_remove
آیا می‌تونم یک یادآور رو حذف کنم,calendar_remove
سلام google لطفا همه برنامه‌های جمعه را لغو کن,calendar_remove
سلام گوگل لطفا برنامه شام پنج‌شنبه را حذف کن,calendar_remove
لطفا همه قرارهای امروز را حذف کن,calendar_remove
الکسا لطفاً همه قرار ملاقات‌های امروز را حذف کن,calendar_remove
رویداد بعدی تقویم را حذف کن,calendar_remove
رویداد بعدی در تقویم را حذف کن,calendar_remove
قرار من ساعت یک فردا را حذف کن,calendar_remove
کنسرت را از رویدادهای تقویم حذف کن,calendar_remove
برنامه پارتی را لغو کن,calendar_remove
برنامه جلسه را تغییر بده,calendar_remove
آیا می‌توانی همه قرارهای من در تقویم را حذف کنی,calendar_remove
آیا می‌توانی همه رویدادهای تقویم من را حذف کنی,calendar_remove
آیا می‌توانی مراجعه به دندانپزشک را از تقویم من حذف کنی,calendar_remove
آیا می‌توانی از تقویم من وقت دندانپزشکی را بیرون بیاوری,calendar_remove
لطفا تقویم فردای من را پاک کن,calendar_remove
رویداد سه شنبه را حذف کن,calendar_remove
قرار در ساعت را حذف کن,calendar_remove
من این هفته کاری انجام نمی‌دهم,calendar_remove
بیا فقط از قرار ملاقات صرف نظر کنیم,calendar_remove
تقویم من را پاک کن همه چیز را حذف کن,calendar_remove
olly همه چیز را از تقویم من برای بقیه سال پاک کن,calendar_remove
رویداد بعدی من را پاک کن,calendar_remove
رویداد آینده را لغو کن,calendar_remove
لطفا همه رویدادها ی برنامه ریزی شده در تقویم من را حذف کن,calendar_remove
لطفا تمام رویدادهای آینده را حذف کن,calendar_remove
لطفا تولد جواد را از تقویم پاک کن,calendar_remove
لطفاً تمام جلسات شرکت زمزم برنامه‌ریزی شده را از تقویم حذف کن,calendar_remove
تمام رویدادهای برنامه‌ریزی شده را از تقویم حذف کن,calendar_remove
می‌توانی تقویم من را خالی کنی,calendar_remove
جشن تولد را از تقویم برای ماه بهمن حذف کن,calendar_remove
کاری را که باید در سه فروردین انجام دهم بردار,calendar_remove
تمام رویدادها را حذف کن,calendar_remove
تقویم جاری را حذف کن,calendar_remove
جلسه فردای من را حذف کن,calendar_remove
تمرین امروز من را حذف کن,calendar_remove
تقویم من را پاک کن,calendar_remove
من نمی‌خواهم هیچ رویدادی در تقویم فهرست شود,calendar_remove
رویداد بعدی من را پاک کن,calendar_remove
رویداد بعدی مرا پاک کن,calendar_remove
رویداد بعدی من را پیدا کن و آن را حذف کن لطفا,calendar_remove
سلام اوولی تمام قرارهای تقویم امروز من را پاک کن,calendar_remove
سلام سیری تمام ملاقات های من برای امروز را از تقویم پاک کن,calendar_remove
سلام اوولی در تاریخ دوازدهم تقویم من را پاک کن,calendar_remove
سلام سیری هر آنچه را که در تقویم من برنامه‌ریزی شده است لغو کن,calendar_remove
همه رویدادهای فردا را حذف کن,calendar_remove
رویداد شام فردای من را حذف کن,calendar_remove
جلسه امروز من را در یک بعدازظهر حذف کن,calendar_remove
رویداد جلسه من برای بیست و نه اسفند در ساعت یک بعدازظهر را حذف کن,calendar_remove
همه رویدادها را از تقویم من حذف کن,calendar_remove
تمام تقویم من را پاک کن,calendar_remove
همه‌ی رویداد‌های این ماه رو از تقویم حذف کن,calendar_remove
تمام رویداد‌های ماه گذشته رو از تقویم پاک کن,calendar_remove
تمام رویدادها از تقویم را حذف کن,calendar_remove
لطفا این رویداد را حذف کن,calendar_remove
می‌تونی این رویداد رو پاک کنی,calendar_remove
نمونه جلسه را از اپلیکیشن تقویم حذف کن,calendar_remove
جلسه ساعت سه را کنسل کن,calendar_remove
تمام رویدادهای تقویم من را پاک کن,calendar_remove
تقویم من را پاک کن,calendar_remove
تقویم من را پاک کن,calendar_remove
رویداد پیش روی تقویم را حذف کن,calendar_remove
جشن چهارشنبه سوری در چهارشنبه آینده در کلیسا را از تقویم حذف کن,calendar_remove
مراسم خیریه برای دلفین ها در اردیبهشت را حذف کن,calendar_remove
این جمعه نهار کاری را کنسل کن,calendar_remove
قرار ملاقات فردای من ساعت سه بعد از ظهر را به من یادآوری کن,calendar_remove
همه چیز در تقویم را پاک کن,calendar_remove
آخرین رویداد من را حذف کن,calendar_remove
می‌توانی آن را از تقویم من حذف کنی,calendar_remove
می‌توانی وقت دکتری که سه شنبه داشتم را حذف کنی,calendar_remove
لطفا رویداد بعدی رو از تقویم من پاک کن,calendar_remove
من دیگر نیازی به مراجعه به دکتر ندارم می‌شود آن رویداد را حذف کرد,calendar_remove
لطفا همه چیز را از تقویم من پاک کن,calendar_remove
هر چیزی را که از تقویم پاک شده نیاز دارم,calendar_remove
لطفا تقویم من را کاملا پاک کن,calendar_remove
همه چیز را از تقویم من حذف کن,calendar_remove
رویدادها را پاک کن,calendar_remove
رویداد تقویم را حذف کن,calendar_remove
قرار نهار در رستوران که برای پنج فروردین رزرو شده بود را کنسل کن,calendar_remove
همه رویدادها را حذف کن,calendar_remove
تمام رویدادها را حذف کن,calendar_remove
تمام رویدادها را پاک کن,calendar_remove
لطفا تمام برنامه‌ها را به زباله‌دان منتقل کن.,calendar_remove
برنامه من برای این تاریخ را پاک کن,calendar_remove
رویداد را از تقویم حذف کن,calendar_remove
رویدادها را حذف کن,calendar_remove
رویداد بعدی در تقویم من را حذف کن که دوباره آن را نبینم,calendar_remove
آیا می‌توانی رویداد بعدی تقویم را که من برای آن دعوت شده بودم حذف کنی,calendar_remove
لطفا رویداد تقویم بعدی را که ایجاد کرده‌ام حذف کن,calendar_remove
رویداد تقویمی پیش رو را حذف کن,calendar_remove
سفر برنامه‌ریزی شده سیزدهم تیر را حذف کن,calendar_remove
لطفا تقویم من را خالی کن,calendar_remove
به روز رویداد برو و آن را حذف کن,calendar_remove
به ماه رویداد برو و حذف کن,calendar_remove
به سال رویداد برو و حذف کن,calendar_remove
همه داده ها را از تقویم پاک کنید,calendar_remove
همه داده‌ها را از تقویم پاک کن,calendar_remove
داده‌ها را از تقویم فرمت کن,calendar_remove
تقویم من را برای بقیه روز پاک کن,calendar_remove
همه چیز را در تقویم من برای دو هفته بعدی حذف کن,calendar_remove
همه جزییات تقویم من را پاک کن,calendar_remove
تقویم من را خالی کن,calendar_remove
رویداد بعدی را لغو کن,calendar_remove
تکلیف بعدی را حذف کن,calendar_remove
رویدادهای تقویم را حذف کن,calendar_remove
لطفا تمام رویدادهای تقویم را حذف کن,calendar_remove
لطفا تمام جلسات امروز بعد از ساعت هفت بعدازظهر را حذف کن,calendar_remove
ملاقات بیست و چهارم فروردین را از برنامه حذف کن,calendar_remove
ناهار با علی را حذف کن,calendar_remove
آن را حذف کن,calendar_remove
تمام قرارهای امروز من را حذف کن,calendar_remove
خوب,calendar_remove
تمام رویداد های من را از تقویم حذف کن,calendar_remove
همه رویدادها را از کل تقویم من حذف کن,calendar_remove
همه چیز را برای این ماه حذف کن,calendar_remove
من می خواهم همه رویدادهایم حذف شود,calendar_remove
یادآوری را پیدا و حذف کن,calendar_remove
رویداد آینده را از محل کارم لغو کن,calendar_remove
تمام برنامه‌های کنسرت را پاک کن,calendar_remove
از امروز برنامه‌های من رو برای هفت روز کنسل کن,calendar_remove
روز تولد زینب رو از رویداد‌ها پاک کن,calendar_remove
قرار ملاقات تاریخ چهاردهم فروردین را لغو کن,calendar_remove
جشن تولد من را لغو کن,calendar_remove
قرار ملاقات من با بیژن را پاک کن,calendar_remove
تعطیلات برنامه‌ریزی شده من برای خرداد را حذف کن,calendar_remove
تمام رویدادهای تقویم را پاک کن,calendar_remove
همه تقویم پاک شود,calendar_remove
جلسه‌ی اداری هفته‌ی آینده‌ی من رو حذف کن,calendar_remove
همه رویدادهای امروز را لغو کن و من را با مشغله علامت گذاری کن,calendar_remove
همه رویدادهای تقویم باقی مانده امروز را به عنوان پاک شده علامت‌گذاری کن,calendar_remove
جلسه در شیراز را حذف کن,calendar_remove
ازدواج سوم تیر را پاک کن,calendar_remove
جشن تولد را پاک کن,calendar_remove
برای هفته بیستم تمام رویدادهای آموزشی را حذف کن,calendar_remove
روز بیست و نهم را پاک کن,calendar_remove
قرارهای پزشکی این آخر هفته رو لغو کن.,calendar_remove
آن رویداد را از تقویم حذف کن,calendar_remove
تمام جلسه‌های امروز را لغو کن,calendar_remove
همه جزئیات در رویداد را حذف کن,calendar_remove
برنامه من را برای این ماه پاک کن,calendar_remove
تمام رویدادهای تقویم را پاک کن,calendar_remove
olly تمام رویدادها را از تقویم پاک کن,calendar_remove
همه رویداد ها را در تقویم مجددا تنظیم کن,calendar_remove
تمام رویدادهای تقویم برای اسفند را پاک کن,calendar_remove
جلسه برنامه‌ریزی شده با اکبر در یک فروردین را حذف کن,calendar_remove
نوبت دکتر را حذف کن من برای ساعت نه صبح بیست و چهارم بهمن به تقویم خود اضافه کرده بودم,calendar_remove
نوبت دکتر من برای دوازدهم اسفند را حذف کن,calendar_remove
لطفاً وقت دکتر اول اسفند در ساعت نه صبح را در تقویم من حذف کن,calendar_remove
لطفاً تقویم من را از همه رویدادها پاک کن,calendar_remove
لطفاً تقویم من را به روز اول بازنشانی کن,calendar_remove
رویداد بعدی تقویم را پاک کن,calendar_remove
رویداد بعدی تقویم پاک کن,calendar_remove
من می خواهم رویداد عروسی را در روز شنبه حذف کنم,calendar_remove
رویداد مهمانی را از تقویم حذف کن,calendar_remove
رویداد سفر را حذف کن,calendar_remove
همه رویدادهای بیست و ششم اسفند را حذف کن,calendar_remove
یادآور تولد من برای هفته آینده را حذف کن,calendar_remove
این رویداد را از اعلانات تقویم من پاک کن,calendar_remove
لطفا این رویداد تقویم را حذف کن,calendar_remove
رویدادها را اطلاعات سرچ من حذف کن,calendar_remove
جلسه کاری در روز چهارشنبه لغو شود,calendar_remove
جلسه بعدی را لغو کن,calendar_remove
صبحانه در خانه لیلا را کنسل کن,calendar_remove
لطفا تقویم من را پاک کن,calendar_remove
جلسه تقویم من در ساعت نه صبح را حذف کن,calendar_remove
رویداد بعدی من را حذف کن,calendar_remove
رویدادها را از تقویم پاک کن,calendar_remove
تمام رویدادها را پاک کن,calendar_remove
مطمئن شو که هیچ رویدادی در تقویم من وجود ندارد,calendar_remove
رویداد بعدی را حذف کن,calendar_remove
یادآور سال نو را از تقویم پاک کن,calendar_remove
همه چیز را از تقویم من پاک کن,calendar_remove
جلسه فردا را از تقویم من لغو کن,calendar_remove
برنامه های روز نوزدهم را از تقویم من خارج کن,calendar_remove
تمام رویدادهای همراه با علی را حذف کن,calendar_remove
قرار ملاقات با امید مرادی را از تقویم من حذف کن,calendar_remove
لطفا تقویم من را پاک کن,calendar_remove
میتونی رویداد بعدی رو حذف کنی,calendar_remove
یادآور جلسه برای سه شنبه را حذف کن,calendar_remove
تمام قرارهای بعد از سه بعدازظهر امروز من را کنسل کن و جزئیاتش را به من اطلاع بده,calendar_remove
در تقویم من تمام رویدادهای گلف من در ماه جاری را حذف کن,calendar_remove
تقویم من را برای شنبه پاک کن,calendar_remove
تمام رویدادهای تقویم را پاک کن,calendar_remove
تمام رویدادها را حذف کن,calendar_remove
رویداد را از تقویم حذف کن,calendar_remove
تقویمم من را پاک کن,calendar_remove
کوتاهی موی امروز را پاک کن,calendar_remove
شام امشب را کنسل کن,calendar_remove
رویداد بعدی امروز را حذف کن,calendar_remove
alexa شام با آریا را از تقویم من حذف کن,calendar_remove
وظایف را باز کن رویدادهای آینده را حذف کن,calendar_remove
لطفا نوبت دکترم را در روز شنبه بردار,calendar_remove
همه رویدادها را از تقویم من حذف کن,calendar_remove
آیا می‌توانی کوتاهی مو را که من برای جمعه برنامه‌ریزی کرده‌ام پاک کنی,calendar_remove
قرار من برای هفده اسفند را پاک کن,calendar_remove
آیا می‌توانی وقت دندانپزشکی را حذف کنی,calendar_remove
همه چیز را برای مابقی سال از تقویم من پاک کن,calendar_remove
لطفا قرار ملاقات برنامه‌ریزی شده بعدی من را حذف کن,calendar_remove
تولد را از تقویم حذف کن,calendar_remove
جلسه دوشنبه‌ی بعد را حذف کن,calendar_remove
قرار شام من برای فردا را حذف کن,calendar_remove
رویداد شام من برای دوشنبه حذف شود,calendar_remove
تمام قرارهای من را لغو کن,calendar_remove
تمام رویدادهای برنامه ریزی شده ی من را حذف کن,calendar_remove
مورد تقویم را حذف کن,calendar_remove
جلسه من برای ساعت دو بعدازظهر امروز را حذف کن,calendar_remove
آن را از تقویم من پاک کن,calendar_remove
تمام رویدادها را از تقویم من پاک کن,calendar_remove
رویدادها را از تقویم حذف کن,calendar_remove
تمام قرارها را حذف کن,calendar_remove
رویداد آینده را حذف کن,calendar_remove
رفتن به خرید که برای سوم فروردین برنامه ریزی کرده‌ام را حذف کن,calendar_remove
فعالیت بعدی من را پاک کن,calendar_remove
همه رویدادها در تقویم را حذف کن,calendar_remove
آن را پاک کن,calendar_remove
تمام رویدادهای تقویم من را حذف کن,calendar_remove
لطفا باقیمانده را حذف کن,calendar_remove
بسیار خب گوگل تولد آرش را از تقویم حذف کن,calendar_remove
رویداد سالگرد ازدواج را از تقویم من حذف کن,calendar_remove
تمام رویدادهای تقویم من را پاک کن,calendar_remove
نوبت پزشکی امروز من را از تقویم حذف کن,calendar_remove
لطفا آن رویداد را حذف کن,calendar_remove
همه چیز رو از تقویمم پاک کن,calendar_remove
شام امشب با شراره را حذف کن,calendar_remove
برنامه‌هایم برای بردن والدینم از فرودگاه را لغو کن,calendar_remove
لطفا این رویداد را از تقویم من حذف کن,calendar_remove
وقت دندانپزشکی امروز را از تقویم من پاک کن,calendar_remove
جلسات روز من را پاک کن,calendar_remove
تماس روزانه من در پنج بعدازظهر را کنسل کن,calendar_remove
تمام رویدادها را تقویم من پاک کن,calendar_remove
تمام رویدادهای پنج روز آینده را حذف کن,calendar_remove
آیا می‌توانی رویداد گذشته‌ای را که من بازدید کردم پاک کنی,calendar_remove
جشن تولد فردا دو بعدازظهر را از تقویم پاک کن,calendar_remove
آیا می‌توانی تمام رویدادها را از تقویم من حذف کنی,calendar_remove
تمام رویدادها و اطلاعات را حذف کن,calendar_remove
تمام رویدادها و برنامه‌ها را حذف کن,calendar_remove
تقویم را پاک کن,calendar_remove
تقویم این ماه را پاک کن,calendar_remove
لطفاً همه رویدادهای تقویم من برای بقیه روز را حذف کن,calendar_remove
جلسه امروز عصر را حذف کن,calendar_remove
جشن عروسی دهم را از تقویم من حذف کن,calendar_remove
لغو کن,calendar_remove
من برای فردا چه برنامه‌ای دارم که باید لغو کنم,calendar_remove
رویداد بعدی را از تقویم حذف کن,calendar_remove
لطفا تمام رویدادهای تقویم من را حذف کن,calendar_remove
همه رویدادهای آخر هفته من را با علی یزدانی پیدا و حذف کن,calendar_remove
خرید خواربار را از برنامه شنبه من حذف کن,calendar_remove
تمام رویداد ها را از تقویم من پاک کن,calendar_remove
آیا راهی هست که دست به کار شوی و تقویم همین ماه من را پاک کنی,calendar_remove
برنامه من را پاک کن,calendar_remove
تقویم را باز کن همه رویدادها را حذف کن,calendar_remove
لطفا جلسه اولیا و معلمان را که در هفده اسفند برنامه‌ریزی شده است حذف کن,calendar_remove
جلسه من در روز چهاردهم لغو شود,calendar_remove
لطفا تقویم من را کاملا پاک کن,calendar_remove
لطفا جلسه‌ای را که امشب با جواد دارم حذف کن,calendar_remove
همه چیز را از تقویم پاک کن,calendar_remove
سلام siri مطمئن شو که تقویم من فردا کاملاً خالی است,calendar_remove
تمام قرارها در تقویم من را لغو کن,calendar_remove
رویداد من در ساعت یک بعدازظهر در تقویم خودم را حذف کن,calendar_remove
رویداد تقویم من در ساعت یک بعد از ظهر امروز را حذف کن,calendar_remove
رویداد را از تقویم پاک کن و رفرش کن,calendar_remove
رویداد بعدی در تقویم را حذف کن,calendar_remove
رویداد بعدی در تقویم را لطفا پاک کن,calendar_remove
نهار پنجشنبه را از تقویم من پاک کن,calendar_remove
جلسه را کنسل کن,calendar_remove
رویداد بعدی را از تقویم حذف کن,calendar_remove
تمام جلسه‌های من را برای باقی هفته حذف کن,calendar_remove
لطفا تمام یادآوری‌های روز یکشنبه را حذف کن,calendar_remove
برنامه امروز من را پاک کن,calendar_remove
تولد مهران را از تقویم حذف کن,calendar_remove
رویداد روز تولد من را از تقویم پاک کن,calendar_remove
در تقویم سه بهمن را خالی کن,calendar_remove
روز بعد از رویداد را حذف کن,calendar_remove
جلسه صبح چهارشنبه را حذف کن,calendar_remove
تولید ناخالص داخلی ایران چقدر است,qa_factoid
در مورد محمدجواد ظریف به من بگو,qa_factoid
که به عنوان معاون وزیر اوتار پرادش منصوب شد,qa_factoid
buttermilk از چه ساخته شده است,qa_factoid
متری شش و نیم چند ستاره توی آی ام دی بی داره,qa_factoid
اینجا کجاست,qa_factoid
به من یک چیزی بگو درباره ی,qa_factoid
شما باید بدانی در مورد,qa_factoid
باراک اوباما کیست,qa_factoid
قد مایکل جکسون چند است,qa_factoid
پایتخت چین کجاست,qa_factoid
بوتسوانا کجاست,qa_factoid
پایتخت مالی کانادا کجاست,qa_factoid
قانون اهم را بر اساس این مقادیر محاسبه کن,qa_factoid
بهترین قیمت برای یک کیبورد حرفه‌ای رو توی گوگل شاپ پیدا کن,qa_factoid
قیمت نفت برای یک بشکه‌ی نفت خام مثلا برای امروز چقدر است,qa_factoid
داستان جدیدترین فیلم مهران مدیری چیه,qa_factoid
به من بگو کدام سیاستمدار تحت نظر است,qa_factoid
کمترین جمعیت در هر مایل مربع در آفریقا چند است,qa_factoid
پارسا پیروزفر در کدام شهر زندگی می کند,qa_factoid
غلامحسین بنان چه زمانی متولد شد,qa_factoid
آیا می توانی به من جزییاتی درباره سفارت هند بدهی,qa_factoid
چه تعداد کشور در اتحادیه اروپا وجود دارد,qa_factoid
گوگوش چند ساله است,qa_factoid
علی نصیریان این روزها چه کار می کند,qa_factoid
بگرد ببین موضوعات کتاب‌های صادق چوبک چیست,qa_factoid
کتاب سیاوش را برای من توضیح بده,qa_factoid
شونزدهمین رئیس جمهور کیست,qa_factoid
چند اونس در یک کوارت است,qa_factoid
رکورد بلندترین موی سر جهان چیست,qa_factoid
فرامرز اصلانی چه زمانی متولد شد,qa_factoid
قد رضا عطاران چقدره,qa_factoid
روز سنت پاتریک,qa_factoid
برای من یک پرواز به مریخ در سال آینده رزرو کن,qa_factoid
ده دقیقه دیگر در کلبه پیتزا خواهم بود و چهل دقیقه دیگر آنجا خواهم ماند برای من یک اسنپ ترتیب بده که بتواند مرا به خانه برساند,qa_factoid
فرامرز اصلانی چند ساله است,qa_factoid
در جهان چه تعداد اقیانوس وجود دارد,qa_factoid
