Text,Intent
از تو می‌خواهم در انجمن حمایت از مصرف کنندگان ایران در مورد تحویل دیرهنگام سیلندر گاز برای من توییت کنی,social_post
آیا میتوانی به خدمات دیجی کالا یک توییت کنی و بگویی که چرا سفارشات من سروقت نرسید,social_post
آلی آیا میتوانی به خدمات دیجی کالا توئیت کنی که سفارشاتم را در وقت برایم ارسال نمیکنند,social_post
به اپل توئیت کن که آیفون کار نمی‌کند,social_post
لطفا به بازرگانی مقداد بگو که محصول اشتباهی فرستاده,social_post
یک شکایت در مورد تلوزیون به سونی بفرست,social_post
خدمات مشتریان دیجی کالا را توئیت کن,social_post
شکایت به پارس آنلاین را توئیت کن,social_post
در توئیتر شکایت ثبت کن,social_post
به ایرانسل توییت کن و به آنها بگو که سرویسشان دوباره قطع شده,social_post
در رستوران نشاط توئیت کن که آنها سفارش من را خراب کردند و من مجبور شدم یک ساعت بیشتر صبر کنم,social_post
یک توئیت پیتزا پرپروک بفرست که خدمات آنها خیلی بد است و من یک ساعت اضافی منتظر ماندم,social_post
به نشاط پیام بده و بگو سفارش من را خراب کردند و من مجبور شدم یک ساعت بیشتر منتظر بمانم,social_post
به شرکت بوتان توئیت کن و به آنها بگو که سرویس آنها دوباره قطع شده است,social_post
آیا میتوانی در مورد کار نکردن دیجی کالا پوست کنی,social_post
به سامسونگ توییت بزن که بدانند ماشین لباسشویی من آتش گرفته است,social_post
عکس در facebook پست کن,social_post
به فست فود هایدا توئیت بزن و بگو داخل برگر آن‌ها یک مو پیدا کردم,social_post
عکسی که همین الان گرفتم را در توئیتر پست کن,social_post
وضعیت های فیس بوک را مدیریت کن,social_post
به رستوران درباره غذایی که به من سرو کرد شکایت کن,social_post
به مرکز راهنمایی رانندگی شکایت در مورد صف بیش از حد طولانی بفرست,social_post
توئیتر فروشگاه رفاه را باز کن,social_post
به شرکت پارس آنلاین یک شکایت بفرست در رابطه با مشکلات سرعت انترنت,social_post
شکایتی درباره کیفیت غذای رستوران بوعلی ارسال کن,social_post
به در نشاط توئیت کن که مرغ من مریض شده,social_post
در نشاط توئیت کن مرغ من خام بود هشتگ مسمومیت غذایی,social_post
به رستوران خاطره توئیت کن و بگو که خدمه شان خیلی گستاخ بود,social_post
لطفاً به الکتریکی رضایی توئیت کن که من امروز از خدماتشان راضی نیستم,social_post
توئیتی به modcloth بفرست که دوست ندارم قیمت‌های حراج را برای من رعایت نکنند,social_post
توئیتر را باز کن تا شکایت من را تایپ کنی و در خدمات مصرف کنندگان پست کنی,social_post
با خدمات مشتری تماس بگیر,social_post
به خدمات مصرف کنندگان این شرکت یک شکایت بفرست,social_post
یک درخواست به این کمپانی بفرست برای بازپس گیری پول,social_post
خدمات بد توئیت کن,social_post
به فروشنده بی‌ادب توئیت کن,social_post
به خاطر زمان انتظار طولانی و کارمندان غیرحرفه‌ای توئیت کن,social_post
سلام شکایت من را به مایکروسافت در twitter ارسال کن,social_post
سلام شکایت من را به مایکروسافت در twitter ارسال کن,social_post
سلام اوولی شکایت من را به ماکروسافت در twitter ارسال کن,social_post
این پیام را به مایکروسافت در twitter ارسال کن,social_post
من می‌خواهم در فیس بوک پست بگذارم,social_post
در گوشی ام این عکس را پست کن در فیسبوک من,social_post
نظرم رو از گوشی موبایل تو فیس بوک بنویس,social_post
یک نظر ضعیف به صفحه پیک برتر بگذار,social_post
یک توئیت در مورد شکایت من به در مورد موتر من به مشتری,social_post
مایکروسافت,social_post
من میخوام از شرکت بوتان یک شکایت توئیت کنم,social_post
یک شکایت مشتری به وب سایت مترو توئیت کن,social_post
یک شکایت مشتری را به راهیان طب صبا توئیت کن,social_post
مریم یک شکایت مشتری از خدمات را به شرکت سایپا توییت کن,social_post
به دیجی کالا توییت کن که من سفارشم را دریافت نکردم,social_post
در نام شرکت توئیت کن که من سفارشم را سر وقت دریافت نکردم,social_post
یک بررسی منفی به در نام شرکت توئیت کن,social_post
شکایت من در مورد خدمات مشتری مس سرچشمه را توئیت کن,social_post
میخواهم یک شکایت به اپل در مورد مشکلات گوشی توئیت کنم,social_post
به خدمات مصرف کننده توئیت کن که کالاها از کیفیت پایینی برخوردار هستند,social_post
به خدمات مصرف کننده توئیت کن که مقدار آن اشتباه است,social_post
deltete,social_post
لطفا توئیت کن که تلوزیون پارس خدمات مشتری وحشتناکی دارد,social_post
توئیتر را باز کن توئیت جدید بنویس که directv خدمات مشتری وحشتناکی دارد,social_post
یک شکایت خدمات مصرف کننده ارسال کن,social_post
یک شکایت در مورد خدمات مشتریان دیجی کالا توئیت کن,social_post
یک شکایت از اپل توئیت کن که عمر مفید باتری هایشان افتضاح است,social_post
به شبکه‌ی خبرنگاران یک توئیت بفرست,social_post
به شرکت برق یک پیام بفرست که برق رفته,social_post
این شکایت را رفرش کن,social_post
سریع حلش کن,social_post
صفحه خانگی فیسبوک مرا چک کن,social_post
میتوانی به فیسبوک پوست کنی که من خانه استم,social_post
یک پست فیسبوک بگذار و بگو من خانه‌ام,social_post
لطفا به هاکوپیان توئیت کن شلوارم بعد از اولین شستشو پاره شد شماره راضی نیستم,social_post
یک شکایت از دونالد ترامپ در مورد اجرای وحشتناکش توئیت کن,social_post
یک شکایت به دیجی کالا در مورد تاخیر در ارسال توئیت کن,social_post
یک شکایت به رفاه در مورد تاخیر در ارسال توئیت کن,social_post
یک شکایت از الکتریکی محمدی بنویس,social_post
من باید یک نظرسنجی بد درباره یاهو بنویسم,social_post
یک شکایت برای سایپا باز کن,social_post
به حساب خدمات مشتریان فروشگاه رفاه توییت کن,social_post
در توئیتر شرکت به خدمات مشتری در توئیت شکایت کن,social_post
یک فرم شکایت بیاور,social_post
من شکایت دارم,social_post
لطفا یک توئیت جدید ایجاد کن,social_post
یک شکایت توئیت کن,social_post
به خدمات مشتریان کابل‌های مخابراتی توئیت کن و به آنها بگو که سی دقیقه پشت خط منتظر مانده‌ام,social_post
به خدمات مشتری شهروند یک توئیت بفرست که سیاست بازپس‌گیری شما ناخوشایند است,social_post
در شرکت مخابرات توئیت کن که کابل دوباره در محله تراس کوهستانی بیرون آمده است,social_post
سیری twitter را باز کن به فرش مشهد توئیت کن که درزهای فرش شما در کمتر از یک ماه نمایان می‌شود,social_post
سیری توئیتر را باز کن و به آقا توئیت کن که وقت شستن بالکونی را فراموش کرده,social_post
ثبت خطا را به اسنوا توئیت کن,social_post
لطفاً در مورد خدمات بد ارائه شده توسط رستوران تورنج برای من tweet کن,social_post
به خدمات مصرف کنندگان شاتل توئیت کن که من ناراضی هستم,social_post
یک شکایت به خدمات مشتز توئیت کن,social_post
در بخش شکایت مشتری نگاه کن و به سلول شکایت برو و آن را استفاده کن,social_post
به دیپارتمنت مشتری از طریق تلفن همراه ارتباط بگیر,social_post
برای پاسخگویی مستقیم با گوشی مشتری تماس بگیر,social_post
خدمات مصرف کنندگان را توئیت کن,social_post
به خدمات مصرف کنندگان در مورد محوطه‌ی کثیف آنها توییت کن,social_post
یک شکایت به خدمات مشتریان فروشگاه رفاه توئیت کن,social_post
به خدمات مشتری google توئیت کن که محصولات آنها بد است,social_post
olly به خدمات مشتری سایپا توئیت کن که محصولات آنها نامرغوب است,social_post
در مورد اینکه چقدر مدیریتشون افتضاح بود یک توئیت بنویس,social_post
به دوستان توئیتر توضیح بدهکه خدمات مشتریان آنها در فروشگاه محلی چقدر وحشتناک است,social_post
در توئیتر بنویس که خدمات مشتریان این منطقه خیلی بده,social_post
لطفا این را سرویس خدمات مشتریان هتل جم توئیت کن,social_post
یک توئیت به خرده فروشی اسپات بفرست که کالا هاشاون خیلی قیمته,social_post
به شرکت بازرگانی محمد توئیت کن,social_post
یک شکایت به این شرکت توئیت کن,social_post
یک توییت درباره‌ی آب موجود در گاز من به پمپ بنزین ولنجک بفرست,social_post
با توئیت کردن شکایت خود را به اسنوا گزارش بده,social_post
گزارش خطا به سامسونگ توئیت کن,social_post
یک توئیت به فست فود هایدا کن که من خوش نیستم,social_post
به شرکت توئیت کن که من کالای شان را پسند نکردم,social_post
لطفا شکایت زیر را توئیت کن,social_post
بگذار فست فود زنجیره‌ای شیلا بداند من از آنها متنفرم,social_post
یک توئیت به یوتیوب بنویس,social_post
میخواهم کنترل کننده توئیتر سامسونگ را ببینم,social_post
یک شکایت از پیتزا شیلا توئیت کن,social_post
یک اعتراض به شهرداری محلی توئیت کن,social_post
توییتر را باز کن و راژمان را نشان بده,social_post
حساب twitter من را باز کن و به قنادی گل و بلبل بگو که آنها سفارش کیک من را خوشمزه پختند,social_post
توئیتی را از طریق پیام به کافه تریا بفرست و به آنها بگو خدمات مشتری آنها عالی است,social_post
یک توئیت به شرکت بفرست,social_post
به شرکت بگو خدمات شان بد است,social_post
یک توئیت شکایت به اسنوا به سامسونگ کن,social_post
یک شکایت به اپل در مورد آیفون هفت من توئیت کن,social_post
اداره,social_post
پست تصویری را باز کن,social_post
لطفا به dsw بگو من کفش‌های معیوب را پس می‌دهم,social_post
دیجی کالا برای ارسال دو آیتمم را فراموش کرده لطفا خبر شان بده,social_post
به فروشگاه رفاه توئیت کن,social_post
دارم به باشگاه میرم لطفا در فیسبوک پست کن,social_post
بازخورد نام شرکت را باز کن,social_post
نام شرکت را باز کن و فرم ها را پیدا کن,social_post
به خدمات مشتریان سونی یک شکایت در مورد تلویزیون‌های هوشمنذشون بنویس,social_post
به خدمات مشتریان کمیته‌ی مشورتی دولت محلی یک شکایت توئیت کن,social_post
به خدمات مشتریان شهروند توئیت کن,social_post
به فروشگاه رفاه یک شکایت در توئیتر بفرست,social_post
به خدمات مشتریان فروشگاه‌های زنجیره‌ای رفاه یک توئیت شکایت کن,social_post
برای همه دوستان فیسبوکم صبح بخیر می‌گویم,social_post
یک شکایت نامه درباره قبض برق زیاد این ماه توئیت کن,social_post
شکایت در مورد چاله‌ها در جاده توئیت کن,social_post
یک شکایت در مورد سیستم زهکشی ضعیف توئیت کن,social_post
من همرای حشرات تچربه بدی داشتم این را به خدمات مشتریان خوتل توئیت کن,social_post
شکایتم را توئیت کن و خدمات مشتریان را هم منشن کن,social_post
در مورد آنچه که می‌توان برای آن انجام داد توئیت کن,social_post
به خدمات مشتریان در مورد مشکلی که با محصول دارم یک توئیت بفرست,social_post
به فروشگاه رفاه یک شکایت بنویس,social_post
شکایت خدمات مصرف کنندگان پیتزا برکه,social_post
شکایت من در مورد کار زهکشی را توئیت کن,social_post
برایم شکایتی در مورد چاله ها در خیابات توئیت کن,social_post
شکایت,social_post
میز مصرف‌کننده,social_post
توئیت شکایت به مراقبت از مشتری,social_post
یک شکایت مشتریان توئیت کن,social_post
یک توئیت به خاطر کارمندان بی‌ادب به همراه اول ارسال کن,social_post
توئیت کن که سرویس رستوران نشاط وحشتناک است,social_post
گوگل توئیت کرد که عطاویچ خدمات وحشتناکی دارد,social_post
به پیتزا برکه توییت کن پیک آنها یک ساعت تاخیر دارد,social_post
به دیجی کالا در مورد اینکه بسته من هرگز به موقع نمی‌رسد توئیت بزن,social_post
برای من شکایت در مورد پیشگیری از بیماری را توئیت کن,social_post
یک شکایت از flipkart در مورد رنگ کفشم توئیت کن,social_post
در دیجی کالا یک شکایت در مورد کیفیت شلوار آنها توییت کن,social_post
شکایتی خطاب به شرکت مخابرات توئیت کن,social_post
شکایت ارسال کن به twitter در,social_post
یک شکایت توئیت کن,social_post
به خدمات مشتریان شهروند توییت کن من از این محصول جدید سینره راضی نیستم,social_post
به خدمات مشتری دیجی کالا این را توئیت کن که من سفارش شماره هزار و صد و هفتاد و ششم را دریافت نکرده‌ام,social_post
از خدمات مشتریان دیجی کالا دات دام بپرس که من چی وقت پولم را دریافت میکنم توئیتر را استفاده کن,social_post
آیا میتوانی این را در فیسبوک بگذاری,social_post
این را در فیسبوک من قرار بده,social_post
شکایت من را در نیروی انتظامی توئیت کن,social_post
یک وضعیت جدید پست کن,social_post
وضعیت را تغییر بده,social_post
شروع کن شکایت به فروشگاه رفاه,social_post
یک شکایت به شرکت بوتان کن,social_post
ات ملی ساپورت من در مورد برخی از کفش‌هایی که هفته گذشته خریدم به کمک نیاز دارم,social_post
به کفش ملی لطفاً در مورد کفش‌های معیوبی که تازه خریدم به من کمک کنید,social_post
توئیت شکایت بنویس,social_post
به دیجی کالا در مورد تحویل دیرهنگام تلویزیون من توئیت کن,social_post
به بانک در مورد عدم دریافت دسته چک توئیت کن,social_post
این محصول هرگز استفاده نشده است,social_post
ممکن است با توجه به این مشکل کوچک برای ما به ارمغان بیاورد,social_post
لطفا برنامه twitter من را باز کن و بخش شکایت برای باغ زندگی را پیدا کن,social_post
یک وضعیت نامزدی در فیسبوک پست کن,social_post
امروز این بیمار توئیت کن,social_post
برای فیسبوک در مورد مدیر ارتقا یافته نوشته کن برای تپه,social_post
دو هفته پس از خرید در فروشگاه رفاه توئیت کن که سجاف‌ها همه شل شده‌اند,social_post
این یک توییت به شاتل بفرست که اگر من انترنت از شما در گوشی ام دارم و اگر انترنت رفت چگونه با شما در تماس شوم,social_post
به نشاط توئیت کن برگرشون خیلی قیمته,social_post
یک توئیت به فروشگاه رفاه بنویس بگو که آنها باید به جای شهروند بسته می‌شدند,social_post
یک توئیت به فروشگاه شهروند بفرست که خدمات آنها خیلی بد است,social_post
سلام میتونی جزئیات اطلاعات مخاطب را به مرکز خدمات خاص بدی,social_post
بازخورد خدمات مشتریان چیست,social_post
در مورد کافه رویا تمام شکایت ها را بکش,social_post
شماره‌ی خدمات مشتریان فروشگاه رفاه را به من نمایش بده,social_post
لطفا توئیت کن که به بوتل آب آنها من را خیلی زیاد شارژ کردن,social_post
لطفا شکایت کن که گوشی من در مرکز خدمات خیلی طولانی است,social_post
به خدمات مصرف کننده توئیت کن که آنها باید تلاش کنند تا سازگارتر باشند,social_post
برای من به خدمات مشتریان دیجی کالا شکایت بفرست,social_post
تقلب در توزین محصولات,social_post
کالا های فیک یا مخلط در بازار,social_post
خیلی خوش خواهم شد اگر این وضعیت را به من پوست کنی,social_post
توئیت کن رستوران بوعلی صف شان همیشه خیلی طولانی است,social_post
در twitter به اسباب بازی امیر بفرست که آنها باید تولید اسباب بازی در ایران را متوقف کنند,social_post
توئیت بزن و درباره خدمات شکایت کن,social_post
توئیت من را به تامین کننده تگ کن,social_post
یک توئیت درباره مصرف کننده را بالا ببر,social_post
من می‌خواهم از مصرف کننده شکایت کنم,social_post
من می‌خواهم با خدمات مشتریان دیجی کالا تماس بگیرم,social_post
خوشحال می‌شوم اگر با خدمات مشتری دیجی کالا تماس بگیری,social_post
یک شکایت درباره‌ی فروشنده‌ی پاتن جامه توییت کن,social_post
لطفا یک توئیت برای فروشگاه کوروش در مورد نداشتن دستشویی تمیز بفرست,social_post
توییت کن عطاویچ داخل شهرک اکباتان سرویس بدی دارد,social_post
یک روز بد در فروشگاه رفاه را توئیت کن,social_post
به ایران ایر توییت کن که آخرین پرواز من از تهران به اصفهان تاخیر داشت,social_post
این وضعیت را به حساب روزنامه اجتماعی من بنداز,social_post
یک شکایت نامه به پارس آنلاین را توئیت کن,social_post
به توئیتر خدمات مشتریان فروشگاه‌های زنجیره‌ای رفاه این شکایت را بنویس,social_post
همراه اول آن را در حساب توئیتر قرار می‌دهد,social_post
به رئیس جمهور توئیت کن که او یک کارش خیلی بده,social_post
یک استاتوس در حساب twitter من ارسال کن,social_post
ده کلمه در اینستاگرام بنویس,social_post
الی یک گزارش منفی درباره شرکت بفرست,social_post
اولی لطفا یک شکایت در مورد فروشگاهی که من بازدید می کنم توئیت کن,social_post
لطفاً یک شکایت درباره‌ی تجربه‌ی وحشتناک من با یک شرکت بفرست,social_post
یک پست بگذار,social_post
وضعیت من را به روز کن,social_post
لطفا یک شکایت بنویس,social_post
یک توئیت به این شرکت کن,social_post
یک پیام خنده دار به همه دوستان من بفرست,social_post
می‌توانی آخرین سلفی من را در حساب facebook خودم بارگذاری کنی,social_post
بیزنس من را در توئیتر پوست کن,social_post
لطفا این را در توئیتر باز توییت کن,social_post
تبریک‌های تولد,social_post
آرزوهای ازدواج,social_post
در پوست دوستان به اشتراک بگذار,social_post
در مورد بازدیدم به ژاپن در توئیتر پست کن,social_post
فیسبوک,social_post
کدام چیز برایم توئیت کن,social_post
عکس سفر من به گوا را در اینستاگرام پست کن,social_post
این را به فیسبوک ال. او. ال. من پست کن,social_post
من خوشحالم را در فیس بوک کنتشر کن,social_post
یک پست جدید در فیسبوک بگذار که بگوید من دارم از هوای خوب لذت می برم,social_post
پیام را اکنون منتشر کن,social_post
می‌خواهم از همه برای تبریک تولد تشکر کنم,social_post
این ویدئو را به فیسبوک پوست کن,social_post
من همرای اسنپ فود خوش نیستم لطفا من را کمک کن,social_post
تنها به اپل توئیت کن که آیفونم کار نمیکنه,social_post
توئیت اپل را باز کن بنویس که باتری آیفون من همیشه خالی است,social_post
به دیجی کالا بگو که گوشی جدید شان آشغال است,social_post
میتوانی به سامسونگ ارتباط بگیری و بگویی که شوینده من آتش گرفته,social_post
مکان فعلی من را توئیت کن,social_post
یک شکایت برای مسائل مرتبط با شبکه به تالیا ارسال کن,social_post
توئیتر را باز کن و پیام بفرست,social_post
توئیت کن که این کالا خیلی بده,social_post
توئیتر را باز کن در سرویس خدمات مصرف کنندگان شکایت من را بنویس,social_post
خیلی سریع برای من یک نفر را بفرست,social_post
دو انگشت پاین به کامکارها آوای فروهر,social_post
یک توئیت به سونی در مورد مشکلات سایز بفرست,social_post
به شرکت هواپیمایی ایران ایر توئیت کن و بگو بابت گک کردن چمدان‌هایم عصبانی هستم,social_post
میخواهم در مورد ایرلاین ماهان توییت کنم که من خیلی قهرم که کیسه هایم گم شده,social_post
من با برگرم مشکل داشتم میتونی به عطاویچ توئیت بفرستی,social_post
یک شکایت twitter ارسال کن,social_post
من محصول را به موقع دریافت نکردم یک توئیت به شرکت فروشگاه‌های زنجیره‌ای رفاه ارسال کن,social_post
به ایرانسل بگو من از آنها متنفرم,social_post
یک شکایت به کتابفروشی آنلاین توئیت کن,social_post
به خرده فروشی اسپات در مورد تمیزی فروشگاه آنها توئیت کن,social_post
لطفا به در آی گون توییت کن که من منتظر سفارشم استم و خوش نیستم,social_post
توئیت جدید برای خدمات مصرف کننده,social_post
سیری twitter را باز کن به روزنامه همشهری توئیت بزن,social_post
یک شکایت از طریق توئیت به ایران خودرو بفرست,social_post
